{
  "name": "pr-upkeep-retry-fix",
  "trigger": {
    "kind": "human.decision",
    "reentry_limit": 1,
    "hop_limit": 20
  },
  "condition": "event.outcome == \"retry\" && !lineage[\"pr-upkeep-route\"].work_item.startsWith(\"gh:\")",
  "action": {
    "kind": "agent.work",
    "with": {
      "graph_workflow": "workflow.yaml",
      "graph_node": "retry-fix",
      "graph_kind": "agent",
      "uses": "actor://company/developer@sha256:3333333333333333333333333333333333333333333333333333333333333333",
      "input": {
        "instruction": "Take the FIRST entry of the `packages` list bound below and\nwork only that package. `pr` names the repository, the pull\nrequest number and the head sha to work against.\n\nA package is one rule in one file, and every finding id in it\nis answered by ONE change \u2014 thirteen instances of a literal\nduplication are one constant, not thirteen commits. Do not\nre-rank the packages, do not merge two of them, and do not\ntouch findings outside the one you took: the analysis already\ndecided that the rest of this file waits for the re-scan after\nyour push, when their line numbers are current again.\n\nImplement the fix on a branch and open or update a pull request\nfor it. NEVER merge anything: this graph's merge step is a\nseparate human-approval node, and an agent merging here would\nbypass it.\n\nIf the package is not actually a defect \u2014 a false positive, or\none whose fix would be wrong \u2014 say so plainly and submit\n`no_change` with the reason. A stated non-fix is a better\noutcome than a manufactured one.\n\nReport which package you took, what you changed, and the PR you\nopened or updated.\n",
        "package": "{pr-upkeep-analyse:packages}",
        "source": "{pr-upkeep-route:source}",
        "repository": "{pr-upkeep-route:repository}",
        "number": "{pr-upkeep-route:number}",
        "head_sha": "{pr-upkeep-route:head_sha:}",
        "work_item": "{pr-upkeep-route:work_item}",
        "findings": "{pr-upkeep-route:findings}"
      },
      "graph_config": {
        "ownerRef": "team/developer-experience",
        "contract": {
          "outcomes": {
            "completed": {
              "schema": {
                "type": "object",
                "required": [
                  "summary"
                ],
                "properties": {
                  "summary": {
                    "type": "string"
                  }
                }
              }
            },
            "no_change": {
              "schema": {
                "type": "object"
              }
            }
          }
        },
        "ledger": {
          "propose": [
            "claim"
          ]
        }
      },
      "actor_selection": [
        {
          "name": "security-findings",
          "node": "fix",
          "actor": "actor://company/security-developer",
          "when": "event.payload.findings.exists(f, f.kind == \"security\")"
        },
        {
          "name": "general-findings",
          "node": "fix",
          "actor": "actor://company/developer"
        }
      ],
      "retry_of": "pr-upkeep-fix"
    }
  },
  "start_node": {
    "name": "pr-upkeep-blocked-fix-done",
    "deadline": "168h"
  },
  "landing_node": {
    "name": "pr-upkeep-fix-done",
    "deadline": "168h"
  },
  "exposes": [
    "pr-upkeep-analyse:packages",
    "pr-upkeep-route:findings",
    "pr-upkeep-route:head_sha",
    "pr-upkeep-route:number",
    "pr-upkeep-route:repository",
    "pr-upkeep-route:source",
    "pr-upkeep-route:work_item"
  ]
}
