{
  "name": "jira-intake-blocked-intake",
  "trigger": {
    "kind": "agent.result",
    "reentry_limit": 1,
    "hop_limit": 20
  },
  "condition": "event.outcome == \"blocked\"",
  "action": {
    "kind": "human.ask",
    "with": {
      "graph_workflow": "workflow.yaml",
      "graph_node": "blocked-intake",
      "graph_kind": "approval",
      "approver_ref": "group/platform-maintainers",
      "input": {
        "question": "intake is blocked. Review the agent report and resolve the obstacle.\nRetry: run the same agent work again.\nAbandon: record that this step is stopped, with no PR or Jira change.\nAcknowledge: record this blocked attempt and end.",
        "blocked_step": "intake",
        "agent_report": "{result}",
        "issue": "{jira-intake-intake:id:}",
        "details_url": "{jira-intake-intake:details_url:}"
      },
      "graph_config": {
        "ownerRef": "team/platform-ai",
        "approverRef": "group/platform-maintainers",
        "deadline": "168h"
      },
      "timeout": "168h",
      "outcomes": [
        "retry",
        "abandon",
        "acknowledged"
      ]
    }
  },
  "start_node": {
    "name": "jira-intake-intake-done",
    "deadline": "2h"
  },
  "landing_node": {
    "name": "jira-intake-blocked-intake-done",
    "deadline": "168h"
  }
}
