{
  "name": "notify-agent-blocked-pr-upkeep-blocked-analyse",
  "trigger": {
    "kind": "agent.result",
    "reentry_limit": 0,
    "hop_limit": 8
  },
  "condition": "event.outcome == \"blocked\"",
  "action": {
    "kind": "discord.post",
    "with": {
      "uses": "actor://company/notify-discord@sha256:aaaaaaaaaaaaaaaaaaaaaaaaaaaaaaaaaaaaaaaaaaaaaaaaaaaaaaaaaaaaaaaa",
      "input": {
        "title": "Agent blocked: pr-upkeep-blocked-analyse",
        "description": "Outcome {outcome}",
        "require_delivery": false
      },
      "graph_config": {
        "ownerRef": "team/platform-ai",
        "contract": {
          "outcomes": {
            "sent": {
              "schema": {
                "type": "object",
                "required": [
                  "delivered",
                  "status_code"
                ]
              }
            },
            "delivery_failed": {
              "schema": {
                "type": "object",
                "required": [
                  "delivered",
                  "status_code"
                ]
              }
            }
          }
        }
      }
    }
  },
  "start_node": {
    "name": "pr-upkeep-analyse-done",
    "deadline": "none"
  },
  "landing_node": {
    "name": "notify-agent-blocked-pr-upkeep-blocked-analyse-done",
    "deadline": "5m"
  },
  "exposes": [
    "outcome"
  ]
}
