{
  "name": "notify-human-needed-pr-upkeep-blocked-stamp-pr",
  "trigger": {
    "kind": "human.requested",
    "reentry_limit": 0,
    "hop_limit": 8
  },
  "condition": "true",
  "action": {
    "kind": "discord.post",
    "with": {
      "uses": "actor://company/notify-discord@sha256:aaaaaaaaaaaaaaaaaaaaaaaaaaaaaaaaaaaaaaaaaaaaaaaaaaaaaaaaaaaaaaaa",
      "input": {
        "title": "Decision needed: pr-upkeep-blocked-stamp-pr",
        "description": "Task {human_task_id}",
        "require_delivery": false
      },
      "graph_config": {
        "ownerRef": "team/platform-ai",
        "contract": {
          "outcomes": {
            "sent": {
              "schema": {
                "type": "object",
                "required": [
                  "delivered",
                  "status_code"
                ]
              }
            },
            "delivery_failed": {
              "schema": {
                "type": "object",
                "required": [
                  "delivered",
                  "status_code"
                ]
              }
            }
          }
        }
      }
    }
  },
  "start_node": {
    "name": "pr-upkeep-blocked-stamp-pr-done",
    "deadline": "none"
  },
  "landing_node": {
    "name": "notify-human-needed-pr-upkeep-blocked-stamp-pr-done",
    "deadline": "5m"
  },
  "exposes": [
    "human_task_id"
  ]
}
