{
  "name": "pr-upkeep-close-blocked-fix",
  "trigger": {
    "kind": "human.decision",
    "reentry_limit": 0,
    "hop_limit": 10
  },
  "condition": "true",
  "action": {
    "kind": "code.run",
    "with": {
      "graph_workflow": "workflow.yaml",
      "graph_node": "close-blocked-fix",
      "graph_kind": "end",
      "uses": "runner://headspace/docker@sha256:57cd7c3a7a273101a6485ba99423ee568157882804b1124b4dd04266317710de",
      "operation": {
        "image": "python:3.12-slim@sha256:57cd7c3a7a273101a6485ba99423ee568157882804b1124b4dd04266317710de",
        "argv": [
          "python3",
          "-c",
          "import json, os\nprint(json.dumps(json.loads(os.environ[\"NODES_INPUT_JSON\"]), sort_keys=True))\n"
        ],
        "network": "none",
        "allowedOutputPaths": []
      },
      "input": {
        "decision": "{outcome}",
        "blocked_step": "fix"
      }
    }
  },
  "start_node": {
    "name": "pr-upkeep-blocked-fix-done",
    "deadline": "168h"
  },
  "landing_node": {
    "name": "pr-upkeep-close-blocked-fix-done",
    "deadline": "none"
  }
}
